{
  "kind": "selfhelp-core-release",
  "id": "selfhelp-core-8.0.0",
  "version": "8.0.0",
  "channel": "stable",
  "releasedAt": "2026-06-01T00:00:00Z",
  "minimumDirectUpgradeFrom": "8.0.0-dev",
  "pluginApiVersion": "2.1",
  "backend": {
    "image": "ghcr.io/humdek-unibe-ch/selfhelp-backend:8.0.0",
    "digest": "sha256:1111111111111111111111111111111111111111111111111111111111111111",
    "phpVersion": "8.4"
  },
  "worker": {
    "image": "ghcr.io/humdek-unibe-ch/selfhelp-worker:8.0.0",
    "digest": "sha256:2222222222222222222222222222222222222222222222222222222222222222"
  },
  "scheduler": {
    "image": "ghcr.io/humdek-unibe-ch/selfhelp-scheduler:8.0.0",
    "digest": "sha256:3333333333333333333333333333333333333333333333333333333333333333"
  },
  "frontendCompatibility": {
    "requiredFrontendRange": ">=8.0.0 <8.1.0"
  },
  "database": {
    "migrationRange": "Version20260501000000..Version20260605081254",
    "destructive": false,
    "requiresBackup": true,
    "manualConfirmationRequired": false
  },
  "security": {
    "signature": "iRnqIMzJlWWR7gfEhwMhHUhtjV+7YKE1Jl8OJkv54HotrXkzeNxnszuqpF17zvgWbFNWCklHI062TMTbKwc8BA==",
    "keyId": "selfhelp-official-2026",
    "signedPayloadSha256": "sha256:73f184aa32ff6f94224d40340c875492a9a288c6db47684ccc4a60ee874f93f9"
  }
}
